Habilitado|4895228611307|LUKE SKYWALKER (BESPIN) DELUXE VERSION SIXTH SCALE FIGURE|ARTICULO|Unidad|FIGURAS DE ACCION|AFECTO|
Habilitado|4580590129641|NENDOROID NARUTO UZUMAKI 4TH-RUN|ARTICULO|Unidad|FIGURAS DE ACCION|AFECTO|
Habilitado|4573102636560|ICHIBANSHO SS SON GOKU VS OMNIBUS ULTRA|ARTICULO|Unidad|FIGURAS DE ACCION|AFECTO|
Habilitado|4573102636577|ICHIBANSHO FIG SON GOKU VS OMNIBUS ULTRA|ARTICULO|Unidad|FIGURAS DE ACCION|AFECTO|
Habilitado|4983164190809|ONE PIECE MANHOOD-SPE VER/A GOLD ROGER|ARTICULO|Unidad|FIGURAS DE ACCION|AFECTO|
Habilitado|4983164190816|ONE PIECE MANHOOD-SPE VER/B EDWARD NEW|ARTICULO|Unidad|FIGURAS DE ACCION|AFECTO|
Habilitado|BDISD641892|POLARIS HILDA THE EARTH REPRESENTATIVE OF ODIN FIG 16 CM SAINT SE|ARTICULO|Unidad|FIGURAS DE ACCION|AFECTO|
Habilitado|BDISD641816|NARUTO UZUMAKI THE NO1 MOST UNPREDICTABLE NINJA VER FIG 13,5 CM N|ARTICULO|Unidad|FIGURAS DE ACCION|AFECTO|
Habilitado|BDISD649461|CHAINSAW MAN FIG 9 CM CHAINSAW MAN FIGUARTS MINI|ARTICULO|Unidad|FIGURAS DE ACCION|AFECTO|
Habilitado|BDISD649393|ANYA FORGER UNIFORM VER FIGURA 8 CM SPY X FAMILY SH FIGUARTS|ARTICULO|Unidad|FIGURAS DE ACCION|AFECTO|
Habilitado|BDISD649355|SUGURU GETO FIG 16,5 CM JUJUTSU KAISEN 0 THE MOVIE SH FIGUARTS|ARTICULO|Unidad|FIGURAS DE ACCION|AFECTO|
Habilitado|BDISD641854|PAN SUPER HERO FIGURA 9 CM DRAGON BALL SUPER: SUPER HERO SH FIGUA|ARTICULO|Unidad|FIGURAS DE ACCION|AFECTO|
Habilitado|BDISD639899|SPIDER-MAN MILES MORALES VER FIG 15,5 CM SPIDER-MAN ACROSS THE SPIDERMAN|ARTICULO|Unidad|FIGURAS DE ACCION|AFECTO|
Habilitado|BDIDB555403|SON GOKU SAIYAN RAISED ON EARTH FIG. 14 CM DRAGON BALL Z SH FIGUARTS|ARTICULO|Unidad|FIGURAS DE ACCION|AFECTO|
Habilitado|GSCNAG12923|HINATA HYUGA FIGURA 10 CM NARUTO SHIPPUDEN NENDOROID|ARTICULO|Unidad|FIGURAS DE ACCION|AFECTO|
Habilitado|BDIJK639028|NOBARA KUGISAKI FIGURA 17 CM JUJUTSU KAISEN FIGUARTS ZERO|ARTICULO|Unidad|FIGURAS DE ACCION|AFECTO|
Habilitado|BDISS638991|SAINT CENTAURUS BABEL FIGURA 16 CM SAINT SEIYA SAINT CLOTH MYTH|ARTICULO|Unidad|FIGURAS DE ACCION|AFECTO|
Habilitado|BDIDB639110|SUPER SAIYAN 4 VEGETA FIGURA 13 CM DRAGON BALL GT SH FIGUARTS|ARTICULO|Unidad|FIGURAS DE ACCION|AFECTO|
Habilitado|4573102551542|EVIL MAJIN BUU DRAGON BALL Z - S.H.FIGUARTS|ARTICULO|Unidad|FIGURAS DE ACCION|AFECTO|
Habilitado|4897072871975|"REPTILE ""MORTAL KOMBAT"" 1/12- STORM COLLECTIBLES"|ARTICULO|Unidad|FIGURAS DE ACCION|AFECTO|
Habilitado|BDISD650580|JANEMBA (EXTRA BATTLE) FIG. 26,5 CM DRAGON BALL Z FIGUARTS ZERO|ARTICULO|Unidad|FIGURAS DE ACCION|AFECTO|
Habilitado|4895228604668|MILES MORALES SPIDER-MAN: INTO THE SPIDER-VERSE - HOT TOYS|ARTICULO|Unidad|FIGURAS DE ACCION|AFECTO|
Habilitado|4895228611437|R2-D2 SIXTH SCALE FIGURE - HOT TOYS|ARTICULO|Unidad|FIGURAS DE ACCION|AFECTO|
Habilitado|BDISD653666|SH FIGUARTS YOR FORGER (MOTHER OF THE FORGER FAMILY) FIG. 15 CM SPY X FAMILY|ARTICULO|Unidad|FIGURAS DE ACCION|AFECTO|
Habilitado|BDHGMK61594|RG 1/144 RX-78-2 GUNDAM|ARTICULO|Unidad|FIGURAS DE ACCION|AFECTO|
Habilitado|BDHGMK61620|RG 1/144 UNICORN GUNDAM RE-RUN|ARTICULO|Unidad|FIGURAS DE ACCION|AFECTO|
Habilitado|BDHGMK63354|HG 1/144 GUNDAM PHARACT|ARTICULO|Unidad|FIGURAS DE ACCION|AFECTO|
Habilitado|SUPER7|FIGURA DE ACCION SUPER 7|ARTICULO|Unidad|FIGURAS DE ACCION|AFECTO|
Habilitado|BDISD649362|SUKUNA FIG 15 CM JUJUTSU KAISEN SH FIGUARTS|ARTICULO|Unidad|FIGURAS DE ACCION|AFECTO|
Habilitado|BDISD641861|SUPER SAIYAN VEGETA -AWAKENED SUPER SAIYAN BLOOD DRAGON BALL Z SH FIGUARTS|ARTICULO|Unidad|FIGURAS DE ACCION|AFECTO|
Habilitado|BDISD641762|CANCER DEATH MASK REVIVAL VER FIG 18 CM SAINT SEIYA MYTH CLOTH EX|ARTICULO|Unidad|FIGURAS DE ACCION|AFECTO|
Habilitado|BDISD640512|CHAINSAW MAN FIG 15 CM CHAINSAW MAN SH FIGUARTS|ARTICULO|Unidad|FIGURAS DE ACCION|AFECTO|
Habilitado|BDISD640321|SUPER SAIYAN TRUNKS -THE BOY FROM THE FUTURE DRAGON BALL Z SH FIGUARTS|ARTICULO|Unidad|FIGURAS DE ACCION|AFECTO|
Habilitado|BDIDG649287|ANGEWOMON FIG 15 CM DIGIMON ADVENTURE S.H. FIGUARTS|ARTICULO|Unidad|FIGURAS DE ACCION|AFECTO|
Habilitado|BDIDB640390|FRIEZA SECOND FORM FIG 19 CM DRAGON BALL Z SH FIGUARTS|ARTICULO|Unidad|FIGURAS DE ACCION|AFECTO|
Habilitado|BDIDB608277|FRIEZA FIRST FORM & FRIEZA POD DRAGON BALL Z SH FIGUARTS|ARTICULO|Unidad|FIGURAS DE ACCION|AFECTO|
Habilitado|BDH0MK65022|BLUE-EYES WHITE DRAGON FIG YU-GI-OH FIGURE RISE STANDARD|ARTICULO|Unidad|FIGURAS DE ACCION|AFECTO|
Habilitado|BDH0MK64256|ANGEMON FIG DIGIMON FIGURE RISE STANDARD|ARTICULO|Unidad|FIGURAS DE ACCION|AFECTO|
Habilitado|4983164194395|BORUTO NNG VIBRATION STARS BORUTO II|ARTICULO|Unidad|FIGURAS DE ACCION|AFECTO|
Habilitado|4983164354065|ONE PIECE SMS TRAFALGAR.LAW THE BRUSH|ARTICULO|Unidad|FIGURAS DE ACCION|AFECTO|
Habilitado|4983164195064|ONE PIECE DIORAMATIC YAMATO THE ANIME|ARTICULO|Unidad|FIGURAS DE ACCION|AFECTO|
Habilitado|4983164195040|ONE PIECE GRANDSTA NERO MONKEY D LUFFY 2|ARTICULO|Unidad|FIGURAS DE ACCION|AFECTO|
Habilitado|4983164192889|NARUTO SHIPPUDEN EFFECT REME-NARUTO|ARTICULO|Unidad|FIGURAS DE ACCION|AFECTO|
Habilitado|4983164193954|ONE PIECE DIO RORONOA ZORO THE ANIME|ARTICULO|Unidad|FIGURAS DE ACCION|AFECTO|
Habilitado|4983164193923|ONE PIECE GRANDISTA SABO MANGA DIMENSION|ARTICULO|Unidad|FIGURAS DE ACCION|AFECTO|
Habilitado|4983164192841|ONE PIECE DXF THE GRANDLINE MEN V11 TBA|ARTICULO|Unidad|FIGURAS DE ACCION|AFECTO|
Habilitado|4983164194753|MY HERO ACADEMIA THE EVIL VILLAINS V6|ARTICULO|Unidad|FIGURAS DE ACCION|AFECTO|
Habilitado|4983164194746|MY HERO ACADEMIA THE AMAZING HEROES V26|ARTICULO|Unidad|FIGURAS DE ACCION|AFECTO|
Habilitado|4983164194739|MY HERO ACADEMIA DXF TOMURA SHIGARAKI|ARTICULO|Unidad|FIGURAS DE ACCION|AFECTO|
Habilitado|4983164194609|DEMON SLAYER FIGURE VOL.28|ARTICULO|Unidad|FIGURAS DE ACCION|AFECTO|
Habilitado|V27BMURATA|DEMON SLAYER FIG V27-A NEZUKO DEMON SLAYER FIG V27-B MURATA|ARTICULO|Unidad|FIGURAS DE ACCION|AFECTO|
Habilitado|4983164194586|DEMON SLAYER FIG V27-A NEZUKO|ARTICULO|Unidad|FIGURAS DE ACCION|AFECTO|
Habilitado|4983164192834|ONE PIECE DXF THE GRANDLINE MEN V10 TBA|ARTICULO|Unidad|FIGURAS DE ACCION|AFECTO|
Habilitado|4983164194906|ONE PIECE BATTLE RECORD COL RORONOA ZORO|ARTICULO|Unidad|FIGURAS DE ACCION|AFECTO|
Habilitado|4983164194890|DRAGON BALL SUPER SUPER HERO DXF-PICCOLO|ARTICULO|Unidad|FIGURAS DE ACCION|AFECTO|
Habilitado|4983164194883|DRAGON BALL Z SHIRETSUDEN III V3 B GOHAN|ARTICULO|Unidad|FIGURAS DE ACCION|AFECTO|
Habilitado|4983164194876|DRAGON BALL Z SHIRETSUDEN III V3 A GOKU|ARTICULO|Unidad|FIGURAS DE ACCION|AFECTO|
Habilitado|4983164194869|DRAGON BALL Z SOLID EDGE V9 B SS TRUNKS|ARTICULO|Unidad|FIGURAS DE ACCION|AFECTO|
Habilitado|4983164194852|DRAGON BALL Z SOLID EDGE V9 A TRUNKS|ARTICULO|Unidad|FIGURAS DE ACCION|AFECTO|
Habilitado|4983164194845|DRAGON BALL Z G MATERIA THE MAJIN BUU|ARTICULO|Unidad|FIGURAS DE ACCION|AFECTO|
Habilitado|4983164195002|MY HERO ACADEMIA IZUKU-B KATSUKI|ARTICULO|Unidad|FIGURAS DE ACCION|AFECTO|
Habilitado|4983164196009|ONE PIECE WORLD FIG COLOS V2 SPEC V|ARTICULO|Unidad|FIGURAS DE ACCION|AFECTO|
Habilitado|4983164194944|ONE PIECE RED THE GRANDLINE V12 A FRANKY|ARTICULO|Unidad|FIGURAS DE ACCION|AFECTO|
Habilitado|4983164194920|ONE PIECE SENKOZEKKEIPORTGAS D ACE|ARTICULO|Unidad|FIGURAS DE ACCION|AFECTO|
Habilitado|60141104|ONE PIECE DXF THE GRANDLINE WANOKUNI V23|ARTICULO|Unidad|FIGURAS DE ACCION|AFECTO|
Habilitado|4983164194999|MY HERO ACADEMIA KATSUKI BAKUGO-A IZUKU|ARTICULO|Unidad|FIGURAS DE ACCION|AFECTO|
Habilitado|4983164195910|DRAGON BALL SUPER: SH MATCH MAKERS-GOKU|ARTICULO|Unidad|FIGURAS DE ACCION|AFECTO|
Habilitado|4983164195903|DRAGON BALL Z G MATERIA THE PICCOLO|ARTICULO|Unidad|FIGURAS DE ACCION|AFECTO|
Habilitado|4983164195880|MY HERO ACADEMIA THE AMAZING HEROES V28 KYOKA JIRO|ARTICULO|Unidad|FIGURAS DE ACCION|AFECTO|
Habilitado|4983164195866|MY HERO ACADEMIA-MOMO YAOYOROZU B|ARTICULO|Unidad|FIGURAS DE ACCION|AFECTO|
Habilitado|4983164195859|MY HERO ACADEMIA-DENKI KAMINARI A|ARTICULO|Unidad|FIGURAS DE ACCION|AFECTO|
Habilitado|4983164195767|DEMON SLAYER FIGURE V30 NEZUKO|ARTICULO|Unidad|FIGURAS DE ACCION|AFECTO|
Habilitado|4983164195521|NARUTO SHIPPUDEN VIBRATION STARS-SASORI|ARTICULO|Unidad|FIGURAS DE ACCION|AFECTO|
Habilitado|4983164195514|NARUTO SHIPPUDEN VIB STARS HINATA B|ARTICULO|Unidad|FIGURAS DE ACCION|AFECTO|
Habilitado|4983164195965|ONE PIECE -GRANDLINE MEN WANOKUNI V24|ARTICULO|Unidad|FIGURAS DE ACCION|AFECTO|
Habilitado|4983164195958|ONE PIECE -GRANDLINE LADY WANOKUNI V10|ARTICULO|Unidad|FIGURAS DE ACCION|AFECTO|
Habilitado|4983164195941|ONE PIECE -GRANDLINE LADY WANOKUNI V9|ARTICULO|Unidad|FIGURAS DE ACCION|AFECTO|
Habilitado|4983164195934|ONE PIECE BATTLE RECD COL TRAFALGAR LAW|ARTICULO|Unidad|FIGURAS DE ACCION|AFECTO|
Habilitado|4983164195927|DRAGON BALL SUPER SH MATCH MAKERS-VEGETA|ARTICULO|Unidad|FIGURAS DE ACCION|AFECTO|
Habilitado|4983164195507|NARUTO SHIPPUDEN VIB STARS SAKURA|ARTICULO|Unidad|FIGURAS DE ACCION|AFECTO|
Habilitado|4573102636713|ICHIBANSHO KAIDO-SIGNS OF THE HIGHT KING|ARTICULO|Unidad|FIGURAS DE ACCION|AFECTO|
Habilitado|4573102636744|ICHIBANSHO ZORO SIGNS OF THE HIGHT KING|ARTICULO|Unidad|FIGURAS DE ACCION|AFECTO|
Habilitado|4573102636737|ICHIBANSHO D LUFFY SIGNS OF THE HIGHT KING|ARTICULO|Unidad|FIGURAS DE ACCION|AFECTO|
Habilitado|4573102636812|ICHIBANSHO KING COLD-VS OMNIBUS GREAT|ARTICULO|Unidad|FIGURAS DE ACCION|AFECTO|
Habilitado|4573102636782|ICHIBANSHO SS GOKU-VS OMNIBUS GREAT|ARTICULO|Unidad|FIGURAS DE ACCION|AFECTO|
Habilitado|4573102636768|ICHIBANSHO SON GOHAN-VS OMNIBUS GREAT|ARTICULO|Unidad|FIGURAS DE ACCION|AFECTO|
Habilitado|4573102636775|ICHIBANSHO PICCOLO-VS OMNIBUS GREAT|ARTICULO|Unidad|FIGURAS DE ACCION|AFECTO|
Habilitado|4573102636805|ICHIBANSHO MECHA FRIEZA-VS OMNIBUS GREAT|ARTICULO|Unidad|FIGURAS DE ACCION|AFECTO|
Habilitado|4573102636799|ICHIBANSHO SS GOHAN-VS OMNIBUS GREAT|ARTICULO|Unidad|FIGURAS DE ACCION|AFECTO|
Habilitado|4580416946049|POP UP PARADE REINER BRAUN|ARTICULO|Unidad|FIGURAS DE ACCION|AFECTO|
Habilitado|4897072871913|KINTARO MORTAL KOMBAT – STORM COLLECTIBLES|ARTICULO|Unidad|FIGURAS DE ACCION|AFECTO|
Habilitado|4897072871494|"MOTARO ""MORTAL KOMBAT"" 1/12 - STORM COLLECTIBLES"|ARTICULO|Unidad|FIGURAS DE ACCION|AFECTO|
Habilitado|4897072870633|VIOLENT KEN ULTRA STREET FIGHTER II THE FINAL CHALLENGER 1/12 - STORM COLLECTIBLES|ARTICULO|Unidad|FIGURAS DE ACCION|AFECTO|
Habilitado|4897072871517|"E. HONDA (NOSTALGIA COSTUME) ""STREET FIGHTER V"" - STORM COLLECTIBLES"|ARTICULO|Unidad|FIGURAS DE ACCION|AFECTO|
Habilitado|HSBF34235L0|MARVEL LEGENDS : RAGNAROK THOR CYBORG EXCLUSIVE|ARTICULO|Unidad|FIGURAS DE ACCION|AFECTO|
Habilitado|4895228602534|IRON MAN MARK 85 BATTLE DAMAGED DIECAST AVENGER ENDGAME - HOT TOYS|ARTICULO|Unidad|FIGURAS DE ACCION|AFECTO|
Habilitado|4895228605832|MYSTERIO''''S IRON MAN ILLUSION SPIDER-MAN: FAR FROM HOME - HOT TOYS|ARTICULO|Unidad|FIGURAS DE ACCION|AFECTO|
Habilitado|45557121143|DBZ SEW V5 B SUPER SAIYAN SON GOHAN|ARTICULO|Unidad|FIGURAS DE ACCION|AFECTO|
Habilitado|45557121129|DBZ SEW V5 A SUPER SAIYAN 2 SON GOHAN|ARTICULO|Unidad|FIGURAS DE ACCION|AFECTO|
Habilitado|45557130756|ONE PIECE DXF THE GRANDLINE MEN V1 TBA|ARTICULO|Unidad|FIGURAS DE ACCION|AFECTO|
Habilitado|45557124069|DEMON SLAYER FIG V6 B TANJIRO KAMADO|ARTICULO|Unidad|FIGURAS DE ACCION|AFECTO|
Habilitado|45557106836|DBS SUPERHERO DXF SON GOKU|ARTICULO|Unidad|FIGURAS DE ACCION|AFECTO|
Habilitado|45557106850|DBS SUPER HERO DXF VEGETA|ARTICULO|Unidad|FIGURAS DE ACCION|AFECTO|
Habilitado|4983164191783|DRAGON BALL SS EDGE V8 B ROSE GOKU BLACK|ARTICULO|Unidad|FIGURAS DE ACCION|AFECTO|
Habilitado|4983164191769|DBZ CHOSENSHIRETSUDEN 3 V1 B SS TRUNKS|ARTICULO|Unidad|FIGURAS DE ACCION|AFECTO|
Habilitado|4983164191752|DBZ CHOSENSHIRETSUDEN 3 V1 A SS GOHAN|ARTICULO|Unidad|FIGURAS DE ACCION|AFECTO|
Habilitado|BDIOP639035|MONKEY D. LUFFY EXTRA BATTLE GEAR 4 BMO FIG 21 CM ONE PIECE FIGUARTS ZERO|ARTICULO|Unidad|FIGURAS DE ACCION|AFECTO|
Habilitado|BDIJK637369|MEGUMI FUSHIGURO FIGURA 21 CM JUJUTSU KAISEN FIGUARTS ZERO|ARTICULO|Unidad|FIGURAS DE ACCION|AFECTO|
Habilitado|BDISS638984|MYTH CLOTH EX AQUARIUS CAMUS REVIVAL VERSION FIGURA 18 CM SAINT SEIYA|ARTICULO|Unidad|FIGURAS DE ACCION|AFECTO|
Habilitado|BDIJK638762|YUTA OKKOTSU FIGURA 15 CM JUJUTSU KAISEN 0: TH MOVIE SH FIGUARTS|ARTICULO|Unidad|FIGURAS DE ACCION|AFECTO|
Habilitado|BDIDB639042|SUPER SAIYAN TRUNKS SECOND SUPER SAIYAN FIG 28 CM DRAGON BALL Z FIGUARTS ZERO|ARTICULO|Unidad|FIGURAS DE ACCION|AFECTO|
Habilitado|BDIDB639103|KRILIN BATTLE CLOTHES FIGURA 11 CM SH FIGUARTS DRAGON BALL Z|ARTICULO|Unidad|FIGURAS DE ACCION|AFECTO|
Habilitado|BDIJK621306|MEGUMI FUSHIGURO FIGURA 9 CM JUJUTSU KAISEN FIGUARTS MINI|ARTICULO|Unidad|FIGURAS DE ACCION|AFECTO|
Habilitado|GOHANSH|SH FIGUARTS GOHAN DRAGON BALL SUPER|ARTICULO|Unidad|FIGURAS DE ACCION|AFECTO|
Habilitado|BDISD653314|GODDESS ATHENEA & SAORI KIDO FIG. 16 CM SAINT SEIYA SAINT CLOTH MYTH CLOTH EX|ARTICULO|Unidad|FIGURAS DE ACCION|AFECTO|
Habilitado|45557129941|NARUTO SHIP VIB STARS UCHIHA ITACHI II - BANPRESTO|ARTICULO|Unidad|FIGURAS DE ACCION|AFECTO|
Habilitado|45557132767|TOKYO REVENGERS KAZUTORA HANEMIYA FIGURE - BANPRESTO|ARTICULO|Unidad|FIGURAS DE ACCION|AFECTO|
Habilitado|45557132989|NARUTO SHIPPUDEN VIBRATION B NARUTO - BANPRESTO|ARTICULO|Unidad|FIGURAS DE ACCION|AFECTO|
Habilitado|45557133658|DBZ CLEARISE SUPER SAIYAN 2 SON GOHAN - BANPRESTO|ARTICULO|Unidad|FIGURAS DE ACCION|AFECTO|
Habilitado|45557133672|DRAGON BALL Z HISTORY BOX VOL.3 - BANPRESTO|ARTICULO|Unidad|FIGURAS DE ACCION|AFECTO|
Habilitado|45557132965|NARUTO SHIPPUDEN VIBRATION A ROCK LEE - BANPRESTO|ARTICULO|Unidad|FIGURAS DE ACCION|AFECTO|
Habilitado|45557131579|ONE PIECE CREATOR X RORONOA ZORO V - BANPRESTO|ARTICULO|Unidad|FIGURAS DE ACCION|AFECTO|
Habilitado|45557133177|JUJUTSU KAISEN GETO-B SUGURU GETO - BANPRESTO|ARTICULO|Unidad|FIGURAS DE ACCION|AFECTO|
Habilitado|45557133153|JUJUTSU KAISEN GETO- A TOGE INUMAKI - BANPRESTO|ARTICULO|Unidad|FIGURAS DE ACCION|AFECTO|
Habilitado|45557133191|JUJUTSU KAISEN FIG TOGE INUMAKI -B PANDA - BANPRESTO|ARTICULO|Unidad|FIGURAS DE ACCION|AFECTO|
Habilitado|45557134587|TOKYO REVENGERS KEN RYUGUJI FIGURE - BANPRESTO|ARTICULO|Unidad|FIGURAS DE ACCION|AFECTO|
Habilitado|45557134389|TOKYO REVENGERS MANJIRO SANO FIGURE - BANPRESTO|ARTICULO|Unidad|FIGURAS DE ACCION|AFECTO|
Habilitado|45557130572|DBZ CLEARISE SUPER SAIYAN VEGETA - BANPRESTO|ARTICULO|Unidad|FIGURAS DE ACCION|AFECTO|
Habilitado|45557133139|JUJUTSU KAISEN MAXIMATIC-YUJI ITADORI - BANPRESTO|ARTICULO|Unidad|FIGURAS DE ACCION|AFECTO|
Habilitado|45557131517|MY HERO ACD AGE OF HEROES LEMILLION SPEC - BANPRESTO|ARTICULO|Unidad|FIGURAS DE ACCION|AFECTO|
Habilitado|45557129149|NARUTO SHIP GRAND HATAKE KAKASHI MANGA D - BANPRESTO|ARTICULO|Unidad|FIGURAS DE ACCION|AFECTO|
Habilitado|45557131180|ONE PIECE GRANDISTA NERO TRAFALGAR LAW - BANPRESTO|ARTICULO|Unidad|FIGURAS DE ACCION|AFECTO|
Habilitado|45557133719|DBS SOLID EDGE WORKS V7 A SS GOGETA - BANPRESTO|ARTICULO|Unidad|FIGURAS DE ACCION|AFECTO|
Habilitado|45557133740|DBS SOLID EDGE WORKS V7 B SS GOD GOGETA - BANPRESTO|ARTICULO|Unidad|FIGURAS DE ACCION|AFECTO|
Habilitado|45557133788|ONE PIECE DXF THE GRANDLINE MEN V1 TBA - BANPRESTO|ARTICULO|Unidad|FIGURAS DE ACCION|AFECTO|
Habilitado|HSBF34775L0|CELL SHADED SPIDERMAN MARVEL LEGENDS|ARTICULO|Unidad|FIGURAS DE ACCION|AFECTO|
Habilitado|HSBF34615L0|THE LIZARD FIGURA  MARVEL LEGENDS|ARTICULO|Unidad|FIGURAS DE ACCION|AFECTO|
Habilitado|HSBF34905L0|SET INNER DEMMON & MR NEGATIVE - MARVEL LEGENDS|ARTICULO|Unidad|FIGURAS DE ACCION|AFECTO|
Habilitado|BDIOP630001|CHARLOTTE LINLIN OIRAN OLIN BATTLE OF MONSTERS ON ONIGASHIMA FIGUARTS ZERO|ARTICULO|Unidad|FIGURAS DE ACCION|AFECTO|
Habilitado|BDINA552785|MINATO NAMIKAZE KURAMA KIZUNA RELATION FIGURA 22 CM FIGUARTS ZERO|ARTICULO|Unidad|FIGURAS DE ACCION|AFECTO|
Habilitado|BDINA550262|NARUTO UZUMAKI KURAMA KIZUNA RELATION FIGURA 21 CM FIGUARTS ZERO|ARTICULO|Unidad|FIGURAS DE ACCION|AFECTO|
Habilitado|BDIJK638779|SATORU GOJO FIGURA 17 CM JUJUTSU KAISEN 0: THE MOVIE SH FIGUARTS|ARTICULO|Unidad|FIGURAS DE ACCION|AFECTO|
Habilitado|BDIDS639660|KAGAYA UBUYASHIKI FIG 9 CM KIMETSU NO YAIBA DEMON SLAYER FIGUARTS MINI|ARTICULO|Unidad|FIGURAS DE ACCION|AFECTO|
Habilitado|BDIDS637253|MUZAN KIBUTSUJI FIGURA 9 CM KIMETSU NO YAIBA DEMON SLAYER FIGUART MINI|ARTICULO|Unidad|FIGURAS DE ACCION|AFECTO|
Habilitado|4983164191653|MY HERO ACADEMIA THE AMAZING HEROES V20|ARTICULO|Unidad|FIGURAS DE ACCION|AFECTO|
Habilitado|4573102636133|BANDAI - DRAGON BALL SUPER HERO - ULTIMATE GOHAN (SUPER HERO) ICHIBAN|ARTICULO|Unidad|FIGURAS DE ACCION|AFECTO|
Habilitado|4573102636096|BANDAI - ONE PIECE - DONQUIXOTE DOFLAMINGO DUEL MEMORIES ICHIBAN|ARTICULO|Unidad|FIGURAS DE ACCION|AFECTO|
Habilitado|4573102602046|BANDAI - ONE PIECE - TRAFALGAR.LAW (WANO COUNTRY -THIRD ACT-) ICHIBAN|ARTICULO|Unidad|FIGURAS DE ACCION|AFECTO|
Habilitado|889698639422|FUNKO POP! MARVEL: BLACK PANTHER - WAKANDA FOREVER - M''''BAKU REGULAR|ARTICULO|Unidad|FIGURAS DE ACCION|AFECTO|
Habilitado|889698639392|FUNKO POP! MARVEL: BLACK PANTHER - WAKANDA FOREVER - IRONHEART MK1 REGULAR|ARTICULO|Unidad|FIGURAS DE ACCION|AFECTO|
Habilitado|889698639385|FUNKO POP! MARVEL: BLACK PANTHER - WAKANDA FOREVER - NAMOR REGULAR|ARTICULO|Unidad|FIGURAS DE ACCION|AFECTO|
Habilitado|889698622653|FUNKO POP! GAMES: POKEMON - LAPRAS REGULAR|ARTICULO|Unidad|FIGURAS DE ACCION|AFECTO|
Habilitado|889698602945|FUNKO POP! ANIMATION: DEMON SLAYER GYOMEI HIMEJIMA W/ TEARS (W/CHASE) EXCLUSIVO|ARTICULO|Unidad|FIGURAS DE ACCION|AFECTO|
Habilitado|889698581462|FUNKO POP! ANIMATION SUPER: NARUTO - PERFECT SUSANOO KAKASHII EXCLUSIVO|ARTICULO|Unidad|FIGURAS DE ACCION|AFECTO|
Habilitado|889698576345|FUNKO POP! MARVEL: SPIDER-MAN: NO WAY HOME: SPIDER-MAN UPGRADED SUIT REGULAR|ARTICULO|Unidad|FIGURAS DE ACCION|AFECTO|
Habilitado|889698563130|FUNKO POP! GAMES: POKEMON - CATERPIE REGULAR|ARTICULO|Unidad|FIGURAS DE ACCION|AFECTO|
Habilitado|889698563116|FUNKO POP! GAMES: POKEMON - PIDGEOTTO REGULAR|ARTICULO|Unidad|FIGURAS DE ACCION|AFECTO|
Habilitado|889698563086|FUNKO POP! GAMES: POKEMON - CHARIZARD REGULAR|ARTICULO|Unidad|FIGURAS DE ACCION|AFECTO|
Habilitado|889698540421|FUNKO POP! GAMES: POKEMON - RAICHU REGULAR|ARTICULO|Unidad|FIGURAS DE ACCION|AFECTO|
Habilitado|889698505468|FUNKO POP! GAMES: POKEMON- JOLTEON REGULAR|ARTICULO|Unidad|FIGURAS DE ACCION|AFECTO|
Habilitado|889698505451|FUNKO POP! GAMES: POKEMON- VAPOREON REGULAR|ARTICULO|Unidad|FIGURAS DE ACCION|AFECTO|
Habilitado|889698468657|FUNKO POP! GAMES: POKEMON - MR. MIME REGULAR|ARTICULO|Unidad|FIGURAS DE ACCION|AFECTO|
Habilitado|889698468640|FUNKO POP! GAMES: POKEMON - MEWTWO REGULAR|ARTICULO|Unidad|FIGURAS DE ACCION|AFECTO|
Habilitado|889698468633|FUNKO POP! GAMES: POKEMON - VULPIX REGULAR|ARTICULO|Unidad|FIGURAS DE ACCION|AFECTO|
Habilitado|889698306973|FUNKO POP! ANIMATION: FULLMETAL ALCHEMIST - ED REGULAR|ARTICULO|Unidad|FIGURAS DE ACCION|AFECTO|
Habilitado|BDISD651587|AOI TODO FIG. 16 CM JUJUTSU KAISEN SH FIGUARTS|ARTICULO|Unidad|FIGURAS DE ACCION|AFECTO|
Habilitado|BDISD654830|YAMATO FIG. 18,5 CM ONE PIECE SH FIGUARTS|ARTICULO|Unidad|FIGURAS DE ACCION|AFECTO|
Habilitado|BDISD654755|BLUE EYES WHITE DRAGON FIG. 22 CM YU-GI-OH! DUEL MONSTERS SH MONSTERS|ARTICULO|Unidad|FIGURAS DE ACCION|AFECTO|
Habilitado|BDISD653628|BYAKUYA KUCHIKI FIG. 15,5 CM BLEACH: THOUSAND -YEAR BLOOD WAR SH FIGUARTS|ARTICULO|Unidad|FIGURAS DE ACCION|AFECTO|
Habilitado|GSC59017090|HAO FIG 10 CM SHAMAN KING NENDOROID|ARTICULO|Unidad|FIGURAS DE ACCION|AFECTO|
Habilitado|BDISD653710|LANCE CROWN FIG. 15,5 CM MASHLE: MAGIC & MUSCLES SH FIGUARTS|ARTICULO|Unidad|FIGURAS DE ACCION|AFECTO|
Habilitado|BDISD651341|RX-78GP00 GUNDAM GP00 BLOSSOM VER A.N.I.M.E. FIG 12,5 CM MS GUNDAM|ARTICULO|Unidad|FIGURAS DE ACCION|AFECTO|
Habilitado|BDISD654984|SH FIGUARTS SPIDER-MAN 2099 FIG. 17,8 CM SPIDER-MAN: ACROSS THE SPIDER-VERSE|ARTICULO|Unidad|FIGURAS DE ACCION|AFECTO|
Habilitado|4897072871296|"IORI YAGAMI ""KING OF FIGHTERS ''''98"" 1/12 - STORM COLLECTIBLES"|ARTICULO|Unidad|FIGURAS DE ACCION|AFECTO|
Habilitado|4573102632425|TENGEN UZUI DEMON SLAYER: KIMETSU NO YAIBA FIGUARTS ZERO|ARTICULO|Unidad|FIGURAS DE ACCION|AFECTO|
Habilitado|4545784043400|POP UP PARADE CHUN-LI|ARTICULO|Unidad|FIGURAS DE ACCION|AFECTO|
Habilitado|4580590170421|NENDOROID SHIGARAKI VILLAIN EDIT RE-RUN|ARTICULO|Unidad|FIGURAS DE ACCION|AFECTO|
Habilitado|4580590170407|NENDOROID DABI RE-RUN|ARTICULO|Unidad|FIGURAS DE ACCION|AFECTO|
Habilitado|4580416945813|POP UP PARADE SANEMI SHINAZUGAWA|ARTICULO|Unidad|FIGURAS DE ACCION|AFECTO|
Habilitado|4580590129894|NENDOROID REINER BRAUN|ARTICULO|Unidad|FIGURAS DE ACCION|AFECTO|
Habilitado|4580416945424|POP UP PARADE NARUTO UZUMAKI|ARTICULO|Unidad|FIGURAS DE ACCION|AFECTO|
Habilitado|4570001944826|DEMON SLAYER PM PERCHING FIG TANJIRO|ARTICULO|Unidad|FIGURAS DE ACCION|AFECTO|
Habilitado|4580779505419|DEMON SLAYER PERCHING KOCHO HASHIRA MEET|ARTICULO|Unidad|FIGURAS DE ACCION|AFECTO|
Habilitado|4580749617333|NENDOROID JOLYNE CUJOH|ARTICULO|Unidad|FIGURAS DE ACCION|AFECTO|
Habilitado|4983164193459|BLEACH SOLID AND SOULS-KENPACHI ZARAKI|ARTICULO|Unidad|FIGURAS DE ACCION|AFECTO|
Habilitado|4983164193817|DRAGON BALL Z CHOSENSH III V2 B TRUNKS|ARTICULO|Unidad|FIGURAS DE ACCION|AFECTO|
Habilitado|4983164193398|TOKYO REVENGERS KING OF ARTIST MANJIRO|ARTICULO|Unidad|FIGURAS DE ACCION|AFECTO|
Habilitado|4983164193893|DEMON SLAYER VS LIMITED TENGEN UZUI II|ARTICULO|Unidad|FIGURAS DE ACCION|AFECTO|
Habilitado|4983164193794|DRAGON BALL Z HISTORY BOX V5|ARTICULO|Unidad|FIGURAS DE ACCION|AFECTO|
Habilitado|4983164193879|ONE PIECE DXF TGL WANOKUNI V22|ARTICULO|Unidad|FIGURAS DE ACCION|AFECTO|
Habilitado|4983164193800|DRAGON BALL Z CHOSENSH III V2 A VEGETA|ARTICULO|Unidad|FIGURAS DE ACCION|AFECTO|
Habilitado|4983164193862|ONE PIECE DXF TGL WANOKUNI V21 B MARCO|ARTICULO|Unidad|FIGURAS DE ACCION|AFECTO|
Habilitado|4983164191967|ONE PIECE SCULTURES BIG COLOSSEUM VI V1|ARTICULO|Unidad|FIGURAS DE ACCION|AFECTO|
Habilitado|4983164193701|MY HERO ACADEMIA THE AMAZING HEROES V24|ARTICULO|Unidad|FIGURAS DE ACCION|AFECTO|
Habilitado|4983164193718|MY HERO ACADEMIA THE AMAZING HEROES V25|ARTICULO|Unidad|FIGURAS DE ACCION|AFECTO|
Habilitado|4983164193886|ONE PIECE KOA THE TRAFALGAR LAW WANOKUNI|ARTICULO|Unidad|FIGURAS DE ACCION|AFECTO|
Habilitado|4983164193787|DRAGON BALL Z G-MATERIA THE VEGITO|ARTICULO|Unidad|FIGURAS DE ACCION|AFECTO|
Habilitado|4983164192896|NARUTO SHIPPUDEN EFFECTREME-SASUKE|ARTICULO|Unidad|FIGURAS DE ACCION|AFECTO|
Habilitado|4983164193824|DRAGON BALL SUPER SH DXF-SS GOHAN|ARTICULO|Unidad|FIGURAS DE ACCION|AFECTO|
Habilitado|4580590126848|INUYASHA NENDOROID SANGO|ARTICULO|Unidad|FIGURAS DE ACCION|AFECTO|
Habilitado|BLFBAS63450|SH FIGUARTS NARUTO SHIPPUDEN : SASUKE UCHIHA|ARTICULO|Unidad|FIGURAS DE ACCION|AFECTO|
Habilitado|889698676052|FUNKO POP! MARVEL: SPIDER-MAN: NO WAY HOME - GREEN GOBLIN REGULAR|ARTICULO|Unidad|FIGURAS DE ACCION|AFECTO|
Habilitado|889698676083|FUNKO POP! MARVEL: SPIDER-MAN: NO WAY HOME - THE AMAZING SPIDER-MAN REGULAR|ARTICULO|Unidad|FIGURAS DE ACCION|AFECTO|
Habilitado|889698676038|FUNKO POP! MARVEL: SPIDER-MAN: NO WAY HOME - DR. STRANGE REGULAR|ARTICULO|Unidad|FIGURAS DE ACCION|AFECTO|
Habilitado|889698623452|FUNKO POP! MARVEL: WANDAVISION - SCARLET WITCH (GW) EXCLUSIVO|ARTICULO|Unidad|FIGURAS DE ACCION|AFECTO|
Habilitado|889698572682|UNKO POP! ANIMATION: ONE PIECE - TRAFALGAR (LATAM EXCLUSIVE VERSION) EXCLUSIVO|ARTICULO|Unidad|FIGURAS DE ACCION|AFECTO|
Habilitado|889698561242|FUNKO POP! ANIMATION: MY HERO ACADEMIA - BAKUGO W/EXPLOSION EXCLUSIVO|ARTICULO|Unidad|FIGURAS DE ACCION|AFECTO|
Habilitado|4897072871630|"SUB-ZERO (UNMASKED) ""MORTAL KOMBAT 3"" - STORM COLLECTIBLES"|ARTICULO|Unidad|FIGURAS DE ACCION|AFECTO|
Habilitado|HSF3457|MARVEL LEGENDS : SPIDER-MAN HOMECOMING PETER PARKER & NED LEEDS TWO-PACK|ARTICULO|Unidad|FIGURAS DE ACCION|AFECTO|
Habilitado|BDHALK63365|ALPHAMON AMPLIFIED FIG DIGIMON FIGURE-RISE|ARTICULO|Unidad|FIGURAS DE ACCION|AFECTO|
Habilitado|BDINA634511|HATAKE KAKASHI THE FAMED SHARINGAN HERO FIG 15 CM NARUTO SHIPPUDE SH FIGUARTS|ARTICULO|Unidad|FIGURAS DE ACCION|AFECTO|
Habilitado|BDISF639097|YOR FORGER FIGURA 15 CM SPY X FAMILY SH FIGUARTS|ARTICULO|Unidad|FIGURAS DE ACCION|AFECTO|
Habilitado|GSC41694542|NARUTO UZUMAKI FIG 14 CM NARUTO SHIPPUDEN POP UP PARADE|ARTICULO|Unidad|FIGURAS DE ACCION|AFECTO|
Habilitado|BDIDS640482|KANAO TSUYURI FIGURA 15 CM KIMETSU NO YAIBA SH FIGUARTS|ARTICULO|Unidad|FIGURAS DE ACCION|AFECTO|
Habilitado|BDIMV639844|VENOM LET THERE BE CARNAGE FIG 19 CM VENOM LTBC SH FIGUARTS|ARTICULO|Unidad|FIGURAS DE ACCION|AFECTO|
Habilitado|BDIOP634702|EUSTASS KIDD EXTRA BATTLE VER FIG 35 CM ONE PIECE FIGUARTS ZERO|ARTICULO|Unidad|FIGURAS DE ACCION|AFECTO|
Habilitado|BDIDB640345|GAMMA 2 FIGURA 14,5 CM DRAGON BALL SUPER HERO SH FIGUARTS|ARTICULO|Unidad|FIGURAS DE ACCION|AFECTO|
Habilitado|BDIDB640338|GAMMA 1 FIGURA 14,5 CM DRAGON BALL SUPER HERO SH FIGUARTS|ARTICULO|Unidad|FIGURAS DE ACCION|AFECTO|
Habilitado|BDIDB637574|PORUNGA & DENDE LUMINOUS DRAGON BALL SET COME FORTH SH FIGUARTS|ARTICULO|Unidad|FIGURAS DE ACCION|AFECTO|
Habilitado|BDIDB640352|TULECE FIG 14,5 CM DRAGON BALL Z SH FIGUARTS|ARTICULO|Unidad|FIGURAS DE ACCION|AFECTO|
Habilitado|BDISS640475|THANATOS FIG 18 CM SAINT SEYA SAINT CLOTH MYTH CLOTH EX|ARTICULO|Unidad|FIGURAS DE ACCION|AFECTO|
Habilitado|BDHGMK63030|HG 1/144 GUNDAM AERIAL RE-RUN|ARTICULO|Unidad|FIGURAS DE ACCION|AFECTO|
Habilitado|BDISD655073|METAL COOLER FIG. 14,5 CM DRAGON BALL Z SH FIGUARTS|ARTICULO|Unidad|FIGURAS DE ACCION|AFECTO|
Habilitado|4895228610706|DOC OCK DELUXE VERSION SPIDER MAN NO WAY HOME – HOT TOY|ARTICULO|Unidad|FIGURAS DE ACCION|AFECTO|
Habilitado|4895228610690|DOC OCK SPIDER-MAN: NO WAY HOME - HOT TOYS|ARTICULO|Unidad|FIGURAS DE ACCION|AFECTO|
Habilitado|BDIDB551542|MAJIN BOO EVIL FIGURA 19 CM DRAGON BALL SH FIGUARTS|ARTICULO|Unidad|FIGURAS DE ACCION|AFECTO|
