Habilitado|PPCX070001|BATERIA PORTATIL BASEUS 10000MAH 20W MAGNETIC MIN|ARTICULO|Unidad|ALMACENAMIENTO|AFECTO|
Habilitado|PPAD030001|BATERIA PORTATIL BASEUS 20000MAH 30W ADAMAN METAL DIGITAL|ARTICULO|Unidad|ALMACENAMIENTO|AFECTO|
Habilitado|PPALL-KU01|BATERIA PORTATIL BASEUS 10000MAH MINI CU|ARTICULO|Unidad|ALMACENAMIENTO|AFECTO|
Habilitado|JBLTUNE110|AUDIFONO JBL TUNE 110 HANDS-FREE CALLS|ARTICULO|Unidad|ALMACENAMIENTO|AFECTO|
Habilitado|SDSDXXY-256G|MICRO SD SANDISK EXTREME PRO CLASE 10 U3 256GB 170MB/S|ARTICULO|Unidad|ALMACENAMIENTO|AFECTO|
Habilitado|SDSQXAV-256G-GN6MN|MICRO SD SANDISK EXTREME CLASE 10 U3 256GB 160MB/S|ARTICULO|Unidad|ALMACENAMIENTO|AFECTO|
Habilitado|RM-RV|REPUESTOS VARIOS|ARTICULO|Unidad|ALMACENAMIENTO|AFECTO|
Habilitado|CAHUB-CT0G|HUB BASEUS METAL GLEAM SERIES TYPE-C DOCKING STATION 11 EN 1|ARTICULO|Unidad|ALMACENAMIENTO|AFECTO|
Habilitado|CAHUB-J0G|HUB BASEUS MECHANICAL EYE SIX-IN ONE SMART RJ45|ARTICULO|Unidad|ALMACENAMIENTO|AFECTO|
Habilitado|CAHUB-DA0G|HUB BASEUS MAGIC MULTIFUNCTIONAL TYPE-C FAST (|ARTICULO|Unidad|ALMACENAMIENTO|AFECTO|
Habilitado|SDSQXAF-032G|MICRO SD SANDISK EXTREME CLASE 10 U3 32GB 100MB/S|ARTICULO|Unidad|ALMACENAMIENTO|AFECTO|
Habilitado|WKWG000003|HUB BASEUS GLEAM 6 EN 1 TYPE-C MUNTIFUNCIONAL|ARTICULO|Unidad|ALMACENAMIENTO|AFECTO|
Habilitado|JBLTUNE130|AUDIFONO TUNE 130 NC BLUETOOTH|ARTICULO|Unidad|ALMACENAMIENTO|AFECTO|
Habilitado|SDSQXCZ-512G|MEMORIA SANDISK MICROSD 512GB EXTREME PRO|ARTICULO|Unidad|ALMACENAMIENTO|AFECTO|
Habilitado|CAKW000301|CABLE BASEUS COOLPLAY FAST CHARGING TYPE C A TYPE C 100W 2M|ARTICULO|Unidad|ALMACENAMIENTO|AFECTO|
Habilitado|CATS000103|CABLE BASEUS EXPLORER AUTO POWER TYPE-C A LIGHTNING 20W 2M|ARTICULO|Unidad|ALMACENAMIENTO|AFECTO|
Habilitado|PPDML-N01|BATERIA PORTATIL BASEUS 30000MAH 20W BIPOW DIGITAL|ARTICULO|Unidad|ALMACENAMIENTO|AFECTO|
Habilitado|SDSQXCD-128G-GN6MA|MICRO SD SANDISK EXTREME PRO CLASE 10 U3 128GB 170MB/S|ARTICULO|Unidad|ALMACENAMIENTO|AFECTO|
Habilitado|SDSQXA1-128G|MICRO SD SANDISK EXTREME CLASE 10 U3 128GB 160MB/S|ARTICULO|Unidad|ALMACENAMIENTO|AFECTO|
Habilitado|JBLENDRUN|AUDIFONO JBL ENDURANCE RUN BLUETOOTH|ARTICULO|Unidad|ALMACENAMIENTO|AFECTO|
Habilitado|MT-58|MONÓPODO ULANZI MT-58- HASTA 120CM -  - INVISIBLE SELFIE STICK|ARTICULO|Unidad|ALMACENAMIENTO|AFECTO|
Habilitado|PPIMDA-D01|BATERIA PORTATIL BASEUS 20000MAH 65W ADAMAN METAL|ARTICULO|Unidad|ALMACENAMIENTO|AFECTO|
Habilitado|PPAD050001|BATERIA PORTATIL BASEUS 20000MAH 30W ADAMAN2 VOOC DIGITAL DISPLAY|ARTICULO|Unidad|ALMACENAMIENTO|AFECTO|
Habilitado|DURACELLAA|CARGADOR DURACELL AA X 4 25000MAH|ARTICULO|Unidad|ALMACENAMIENTO|AFECTO|
Habilitado|CAHUB-F01|HUB BASEUS ROUND BOX 4 USB|ARTICULO|Unidad|ALMACENAMIENTO|AFECTO|
Habilitado|PPHD010|BATERIA PORTATIL BASEUS 10000MAH 87W STACION 4 HYBRID GAN TYPE-C USB|ARTICULO|Unidad|ALMACENAMIENTO|AFECTO|
Habilitado|PPJL000001|BATERIA PORTATIL BASEUS 20000MAH 65W ELF DIGITAL DISPLAY FAST (|ARTICULO|Unidad|ALMACENAMIENTO|AFECTO|
Habilitado|PPNLD-D01|BATERIA PORTATIL BASEUS 10000MAH 45W CARGADOR USB TYPE-C|ARTICULO|Unidad|ALMACENAMIENTO|AFECTO|
Habilitado|CAHUB-BC0G|ADAPTADOR BASEUS SWITCHER HDMI MATRIX|ARTICULO|Unidad|ALMACENAMIENTO|AFECTO|
Habilitado|PPXJ060101|BATERIA PORTATIL BASEUS 30000MAH 22.5 STAR-LORD DIGITAL DISPLAY|ARTICULO|Unidad|ALMACENAMIENTO|AFECTO|
Habilitado|PPXJ80001|BATERIA PORTATIL BASEUS 20000MAH 22.5W STAR LORD DIGITAL DISPLAY 30CM|ARTICULO|Unidad|ALMACENAMIENTO|AFECTO|
Habilitado|JBLTUN215|AUDIFONO JBL TUNE 215 BLUETOOTH|ARTICULO|Unidad|ALMACENAMIENTO|AFECTO|
Habilitado|JBLVIBETM|AUDIFONO JBL VIBE BEAM TWS|ARTICULO|Unidad|ALMACENAMIENTO|AFECTO|
Habilitado|PPALL-QB01|BATERIA PORTATIL BASEUS 10000MAH TYPE C USB SIMBO SMART|ARTICULO|Unidad|ALMACENAMIENTO|AFECTO|
Habilitado|SDSQXCY-064G|MICRO SD SANDISK EXTREME PRO CLASE 10 U3 64GB 170MB/S|ARTICULO|Unidad|ALMACENAMIENTO|AFECTO|
Habilitado|PPBD050201|BATERIA PORTATIL BASEUS 30000MAH 15W BIPOW DIGITAL|ARTICULO|Unidad|ALMACENAMIENTO|AFECTO|
Habilitado|CCSUP-A01|CARGADOR BASEUS TYPE-C SUPER SI QUICK 1C 20W|ARTICULO|Unidad|ALMACENAMIENTO|AFECTO|
Habilitado|SDSQXAH-064G-GN6MN|MICRO SD SANDISK EXTREME CLASE 10 U3 64GB 160MB/S|ARTICULO|Unidad|ALMACENAMIENTO|AFECTO|
Habilitado|JBLTUNE230|AUDIFONO JBL TUNE 230NC BLUETOOTH 5.2|ARTICULO|Unidad|AUDIO|AFECTO|
Habilitado|SAMSUNGBUDS2PRO|AUDIFONO SAMSUNG GALAXY BUDS2 PRO|ARTICULO|Unidad|AUDIO|AFECTO|
Habilitado|JBLTUNE215|AUDIFONO JBL TUNE 215 BLUETOOTH|ARTICULO|Unidad|AUDIO|AFECTO|
Habilitado|TRMGROV2|PARLANTE TRONSMART GROOVE 2|ARTICULO|Unidad|AUDIO|AFECTO|
Habilitado|JBLCHARGE5|PARLANTE JBL CHARGE 5 BLUETOOTH|ARTICULO|Unidad|AUDIO|AFECTO|
Habilitado|APPLE-MV7N2AM/A|AIRPODS (2ND GENERATION) WITH CHARGING CASE - WHITE|ARTICULO|Unidad|AUDIO|AFECTO|
Habilitado|LENOVOXT80|AUDIFONO LENOVO XT80 DEPORTIVO TWS BLUETOOTH 5.3 NEW|ARTICULO|Unidad|AUDIO|AFECTO|
Habilitado|REDMIB4T|AUDIFONO XIAOMI REDMI BUDS LITE 4 TWS|ARTICULO|Unidad|AUDIO|AFECTO|
Habilitado|TRMET2P|PARLANTE TRONSMART ELEMENT T2 PLUS|ARTICULO|Unidad|AUDIO|AFECTO|
Habilitado|JBLGO3|PARLANTE JBL GO3 BLUETOOTH V5.1|ARTICULO|Unidad|AUDIO|AFECTO|
Habilitado|JBLENDUPEAK3|AUDIFONO JBL ENDURANCE PEAK3 TWS|ARTICULO|Unidad|AUDIO|AFECTO|
Habilitado|JBLFLIP6|PARLANTE JBL FLIP 6|ARTICULO|Unidad|AUDIO|AFECTO|
Habilitado|JBLTUNE520|AUDIFONO JBL TUNE 520 BLUETOOTH|ARTICULO|Unidad|AUDIO|AFECTO|
Habilitado|ECHODOT5TAS|PARLANTE AMAZON ALEXA ECHO DOT 5TA ( SIN RELOJ )|ARTICULO|Unidad|AUDIO|AFECTO|
Habilitado|JBLLIVEFREE|AUDIFONO JBL LIVE FREE NC+ TWS|ARTICULO|Unidad|AUDIO|AFECTO|
Habilitado|SKCMODTWS|AUDIFONO SKULLCANDY MOD TWS TRUE WIRELESSS|ARTICULO|Unidad|AUDIO|AFECTO|
Habilitado|JBLBOOMBOX3|PARLANTE JBL BOOMBOX 3 BLUETOOTH 5.3|ARTICULO|Unidad|AUDIO|AFECTO|
Habilitado|BQ6933- 007|ZAPATILLAS URBANAS JORDAN RETRO 1 BLACK GOLD INFANTE 23.5|ARTICULO|Unidad|CALZADO|AFECTO|
Habilitado|ADI20000|ADIDAS ADI20000|ARTICULO|Unidad|CALZADO|AFECTO|
Habilitado|AIR FORCE|AIR FORCE 1|ARTICULO|Unidad|CALZADO|AFECTO|
Habilitado|DZ4475- 026|ZAPATILLAS JORDAN MVP 41|ARTICULO|Unidad|CALZADO|AFECTO|
Habilitado|CINSAAXN|ESTUCHE RIGIDO INSTA360 ACE PRO|ARTICULO|Unidad|CAMARAS DE ACCION|AFECTO|
Habilitado|CINSBAJA|BATERIA INSTA360 ACE PRO|ARTICULO|Unidad|CAMARAS DE ACCION|AFECTO|
Habilitado|CHDFB-111-CN|GOPRO HERO 11 CREATOR EDITION|ARTICULO|Unidad|CAMARAS DE ACCION|AFECTO|
Habilitado|APHGM-001|VOLTA|ARTICULO|Unidad|CAMARAS DE ACCION|AFECTO|
Habilitado|ADDBD-211|CARGADOR DOBLE + BATERIA ENDURO  ( HB11B_H10B_H9B)|ARTICULO|Unidad|CAMARAS DE ACCION|AFECTO|
Habilitado|ADBAT-011|BATERIA ENDURO ( HB11B_H10B_H9B)|ARTICULO|Unidad|CAMARAS DE ACCION|AFECTO|
Habilitado|APHGM-002|SIMPLE POLE - EL GRANDE|ARTICULO|Unidad|CAMARAS DE ACCION|AFECTO|
Habilitado|CN9500001NA9|DJI RS 3 MINI - ESTABILIZADOR PARA CAMARA|ARTICULO|Unidad|CAMARAS DE ACCION|AFECTO|
Habilitado|CINSABKA|CÁMARA INSTA360 GO 3|ARTICULO|Unidad|CAMARAS DE ACCION|AFECTO|
Habilitado|CINSBAQG|"ESTUCHE RÍGIDO ORIGINAL INSTA360 PARA CÁMARA X3 Y ONE X2 -
23.2X15.7X6.7CM"|ARTICULO|Unidad|CAMARAS DE ACCION|AFECTO|
Habilitado|CINSBAQB|"PROTECTOR DE SILICONA INSTA360 PARA LENTES DE CÁMARA X3 -
LENS CAP"|ARTICULO|Unidad|CAMARAS DE ACCION|AFECTO|
Habilitado|PT-21|MONTURA DE ZAPATA ULANZI PARA CÁMARA INSTA360 ONE X2 X3|ARTICULO|Unidad|CAMARAS DE ACCION|AFECTO|
Habilitado|CINSBAQ/A|"ADAPTADOR DE MICRÓFONO DE 3.5MM PARA CÁMARA INSTA360 X3
CON PUERTO DE CARGA"|ARTICULO|Unidad|CAMARAS DE ACCION|AFECTO|
Habilitado|CINSBAQC|"CARCASA SUMERGIBLE INSTA360 PARA X3 (HASTA 50 METROS) -
DIVE CASE"|ARTICULO|Unidad|CAMARAS DE ACCION|AFECTO|
Habilitado|CINSBAQF|"CARCASA DE ACCESORIOS SMALLRIG PARA CÁMARA INSTA360 X3 -
UTILITY FRAME"|ARTICULO|Unidad|CAMARAS DE ACCION|AFECTO|
Habilitado|CINSAAQ/B|CÁMARA INSTA360 X3 (SIN MEMORIA MICRO SD)|ARTICULO|Unidad|CAMARAS DE ACCION|AFECTO|
Habilitado|BY-M1-PRO|"MICRÓFONO PECHERO BOYA BY-M1 PRO OMNIDIRECCIONAL PARA
CÁMARAS, CELULARES Y GRABADORAS BY2009451930"|ARTICULO|Unidad|CAMARAS DE ACCION|AFECTO|
Habilitado|CINSBAQE|PROTECTORES DE LENTE ADHESIVOS INSTA360 PARA CÁMARA X3 - LENS GUARDS|ARTICULO|Unidad|CAMARAS DE ACCION|AFECTO|
Habilitado|CINOXBC/A|CARGADOR DUAL INSTA360 PARA BATERÍA DE ONEX (CARGA RÁPIDA)|ARTICULO|Unidad|CAMARAS DE ACCION|AFECTO|
Habilitado|CINOXPH/B|CARCASA PROTECTORA INSTA360 PARA ONE X (HASTA  5 METROS) - VENTURE CASE|ARTICULO|Unidad|CAMARAS DE ACCION|AFECTO|
Habilitado|CINOXWH/A|CARCASA SUMERGIBLE INSTA360 PARA ONE X (HASTA 30 METROS) - DIVE CASE|ARTICULO|Unidad|CAMARAS DE ACCION|AFECTO|
Habilitado|GOPRO11|GOPRO HERO 11 BLACK|ARTICULO|Unidad|CAMARAS DE ACCION|AFECTO|
Habilitado|ONE-X|CÁMARA INSTA360 ONE X (SIN MEMORIA MICRO SD)|ARTICULO|Unidad|CAMARAS DE ACCION|AFECTO|
Habilitado|ONE-R-TE|CÁMARA INSTA360 ONE R - TWIN EDITION (MÓDULOS: 4K Y 360 - SIN MEMORIA MICRO SD)|ARTICULO|Unidad|CAMARAS DE ACCION|AFECTO|
Habilitado|ONE-R-4KE|CÁMARA INSTA360 ONE R - 4K EDITION (MÓDULO 4K - SIN MEMORIA MICRO SD)|ARTICULO|Unidad|CAMARAS DE ACCION|AFECTO|
Habilitado|ONE-R-LE|CÁMARA INSTA360 ONE R - LEICA EDITION (MÓDULO: 1 PULGADA - SIN MEMORIA MICRO SD)|ARTICULO|Unidad|CAMARAS DE ACCION|AFECTO|
Habilitado|ONE-R-360E|CÁMARA INSTA360 ONE R - 360 EDITION (MÓDULO: 360 - SIN MEMORIA MICRO SD)|ARTICULO|Unidad|CAMARAS DE ACCION|AFECTO|
Habilitado|ONE-R-TRIO|CÁMARA INSTA360 ONE R - TRIO EDITION (MÓDULOS: 4K, 360 Y LEICA - SIN MEMORIA MICRO SD)|ARTICULO|Unidad|CAMARAS DE ACCION|AFECTO|
Habilitado|ONE-X-2|CÁMARA INSTA360 ONE X 2 (SIN MEMORIA MICRO SD)|ARTICULO|Unidad|CAMARAS DE ACCION|AFECTO|
Habilitado|CINBTCT/A|CONTROL REMOTO INSTA360 SMART GPS PARA CÁMARAS ONE R, ONE X|ARTICULO|Unidad|CAMARAS DE ACCION|AFECTO|
Habilitado|DINKYKQ/A|"CONTROL REMOTO ""ROADIE"" PARA CÁMARAS ONE RS R"|ARTICULO|Unidad|CAMARAS DE ACCION|AFECTO|
Habilitado|CINFSFX/A|ACCESORIO DRIFTER PARA CÁMARA INSTA360 ONE X|ARTICULO|Unidad|CAMARAS DE ACCION|AFECTO|
Habilitado|CINDTCA/B|CABLE INSTA360 PARA CONEXIÓN DE DATOS PARA DISPOSITIVOS ANDROID (MICRO USB Y TIPO C)|ARTICULO|Unidad|CAMARAS DE ACCION|AFECTO|
Habilitado|CINDTCA/C|CABLE INSTA360 PARA CONEXIÓN DE DATOS PARA DISPOSITIVOS APPLE (LIGHTNING)|ARTICULO|Unidad|CAMARAS DE ACCION|AFECTO|
Habilitado|INSTA-MAVIC-AIR|SOPORTE INSTA360 PARA DRONE MAVIC AIR|ARTICULO|Unidad|CAMARAS DE ACCION|AFECTO|
Habilitado|INSTA-MAVIC-2|SOPORTE INSTA360 PARA DRONE MAVIC 2|ARTICULO|Unidad|CAMARAS DE ACCION|AFECTO|
Habilitado|CINSAAVN|KIT SOPORTE Y ACCESORIOS INSTA360 PARA BICICLETA|ARTICULO|Unidad|CAMARAS DE ACCION|AFECTO|
Habilitado|INSTA-RUN|SOPORTE Y ACCESORIOS INSTA360 PARA CORRER|ARTICULO|Unidad|CAMARAS DE ACCION|AFECTO|
Habilitado|INSTA-SKATE|SOPORTE Y ACCESORIOS INSTA360 PARA SKATE|ARTICULO|Unidad|CAMARAS DE ACCION|AFECTO|
Habilitado|INSTA-MOTO|SOPORTE Y ACCESORIOS INSTA360 PARA MOTOCICLETA|ARTICULO|Unidad|CAMARAS DE ACCION|AFECTO|
Habilitado|INSTA-WAIST|SOPORTE INSTA360 PARA LA CINTURA (PARA USO CON INVISIBLE SELFIE STICK)|ARTICULO|Unidad|CAMARAS DE ACCION|AFECTO|
Habilitado|INSTA-FUTBOL|SOPORTE Y ACCESORIOS INSTA360 PARA FÚTBOL|ARTICULO|Unidad|CAMARAS DE ACCION|AFECTO|
Habilitado|CINTYAV/C|SOPORTE DE MANO Y MUÑECA PARA CÁMARAS INSTA360|ARTICULO|Unidad|CAMARAS DE ACCION|AFECTO|
Habilitado|SCORPC3|GIMBAL FEIYUTECH SCORP C 3-AXIS|ARTICULO|Unidad|CAMARAS DE ACCION|AFECTO|
Habilitado|SCORPF2|GIMBAL FEIYUTECH SCORP F2 DSLR 3-AXES DSLR|ARTICULO|Unidad|CAMARAS DE ACCION|AFECTO|
Habilitado|SCORPOMINI|GIMBAL FEIYUTECH SCORP MINI|ARTICULO|Unidad|CAMARAS DE ACCION|AFECTO|
Habilitado|5884737|CAMARA DE ACCION GOPRO HERO12 BLACK|ARTICULO|Unidad|CAMARAS DE ACCION|AFECTO|
Habilitado|CINCHUX/B|SOPORTE DE MENTÓN PARA CASCO - PARA CÁMARAS INSTA360|ARTICULO|Unidad|CAMARAS DE ACCION|AFECTO|
Habilitado|INSTA-DASHCAM|SOPORTE DASHCAM PARA CÁMARAS INSTA360 CON QUICK RELEASE|ARTICULO|Unidad|CAMARAS DE ACCION|AFECTO|
Habilitado|CINTYPJ/A|AGARRADERA DE MANO FLOTANTE - PARA CÁMARAS INSTA360|ARTICULO|Unidad|CAMARAS DE ACCION|AFECTO|
Habilitado|CINSTAV/C|SOPORTE INSTA360 PARA MOCHILA (PARA VISTA EN TERCERA PERSONA)|ARTICULO|Unidad|CAMARAS DE ACCION|AFECTO|
Habilitado|MGFLO-TELESIN|MANGO FLOTANTE TELESIN – GOPRO|ARTICULO|Unidad|CAMARAS DE ACCION|AFECTO|
Habilitado|CINORCC/A|MÓDULO DE LENTE DUAL 360 INSTA360 PARA CÁMARA ONE R|ARTICULO|Unidad|CAMARAS DE ACCION|AFECTO|
Habilitado|CINORC4/A|MÓDULO DE LENTE LEICA DE 1 PULGADA INSTA360 PARA CÁMARA ONE R|ARTICULO|Unidad|CAMARAS DE ACCION|AFECTO|
Habilitado|CINORBC/A|CARGADOR DUAL INSTA360 PARA BATERÍAS DE CÁMARA ONE R (CARGA RÁPIDA)|ARTICULO|Unidad|CAMARAS DE ACCION|AFECTO|
Habilitado|CINORLG/A|PROTECTORES DE LENTE INSTA360 PARA MÓDULO 360 DE CÁMARA ONE R|ARTICULO|Unidad|CAMARAS DE ACCION|AFECTO|
Habilitado|CINORAD/A|ADAPTADOR DE MICRÓFONO INSTA360 PARA CÁMARA ONE R|ARTICULO|Unidad|CAMARAS DE ACCION|AFECTO|
Habilitado|CINORAW/A|CARCASA SUMERGIBLE PARA CÁMARA INSTA360 ONE R CON EL MÓDULO 360 - VERTICAL (HASTA 60 METROS)|ARTICULO|Unidad|CAMARAS DE ACCION|AFECTO|
Habilitado|CINORXW/A|CARCASA SUMERGIBLE PARA CÁMARA INSTA360 ONE R CON EL MÓDULO 4K (HASTA 60 METROS)|ARTICULO|Unidad|CAMARAS DE ACCION|AFECTO|
Habilitado|CINORPW/A|"CARCASA SUMERGIBLE PARA CÁMARA INSTA360 ONE R CON EL MÓDULO LEICA DE 1"" (HASTA 60 METROS)"|ARTICULO|Unidad|CAMARAS DE ACCION|AFECTO|
Habilitado|DINORSC/A|ESTUCHE RÍGIDO ORIGINAL INSTA360 PARA CÁMARA ONE R Y ACCESORIOS|ARTICULO|Unidad|CAMARAS DE ACCION|AFECTO|
Habilitado|CINORMB/A|BRACKET PARA CÁMARA ONE R (IGUAL AL QUE VIENE CON LA CÁMARA, SIN ZAPATA)|ARTICULO|Unidad|CAMARAS DE ACCION|AFECTO|
Habilitado|CINORMB/B|BRACKET CON MONTURA DE ZAPATA PARA CÁMARA ONE R|ARTICULO|Unidad|CAMARAS DE ACCION|AFECTO|
Habilitado|DINADJS/A|MONTURA INSTA360 TIPO UNICORNIO PARA CASCO|ARTICULO|Unidad|CAMARAS DE ACCION|AFECTO|
Habilitado|CINFSSF/A|PROTECTORES DE LENTE ADHESIVOS PARA CÁMARA INSTA360 ONE R /ONE RS - MÓDULO 360|ARTICULO|Unidad|CAMARAS DE ACCION|AFECTO|
Habilitado|INSTA-ONE-R-USB|REPUESTO DE TAPA USB PARA CÁMARA INSTA360 ONE R|ARTICULO|Unidad|CAMARAS DE ACCION|AFECTO|
Habilitado|GP-CSS-T|CASE SUPER SUIT PARA GOPRO HERO 11/10/9  - TELESIN|ARTICULO|Unidad|CAMARAS DE ACCION|AFECTO|
Habilitado|INSTA-ONE-R-CASE1|ESTUCHE RÍGIDO GENÉRICO PARA CÁMARA ONE R Y ACCESORIOS|ARTICULO|Unidad|CAMARAS DE ACCION|AFECTO|
Habilitado|CINORHC/A|MARCO VERTICAL PARA CÁMARA INSTA360 ONE R (PARA USO CON BATERÍA VERTICAL)|ARTICULO|Unidad|CAMARAS DE ACCION|AFECTO|
Habilitado|CINORHM/A|BATERÍA DE BASE VERTICAL INSTA360 PARA CÁMARA ONE R|ARTICULO|Unidad|CAMARAS DE ACCION|AFECTO|
Habilitado|CINORBT/C|BATERÍA BOOSTED PARA CÁMARA INSTA360 ONE R - BOOSTED BATTERY BASE|ARTICULO|Unidad|CAMARAS DE ACCION|AFECTO|
Habilitado|INSTA-CORE|MÓDULO DE CÁMARA INSTA360 ONE R - CORE|ARTICULO|Unidad|CAMARAS DE ACCION|AFECTO|
Habilitado|INSTA-4K-MOD|MÓDULO DE LENTE 4K (SIN CAJA)|ARTICULO|Unidad|CAMARAS DE ACCION|AFECTO|
Habilitado|INSTA-360-MOD|MODULO DE LENTE 360 SOLO (CON PROTECTOR DE GOMA, SIN CAJA)|ARTICULO|Unidad|CAMARAS DE ACCION|AFECTO|
Habilitado|CINSPHD/D|INVISIBLE SELFIE STICK INSTA360 PARA ONE R, ONE X - 120CM MAX|ARTICULO|Unidad|CAMARAS DE ACCION|AFECTO|
Habilitado|CINORSC/D|BRACKET INSTA360 MARCO PARA CÁMARA ONE RS|ARTICULO|Unidad|CAMARAS DE ACCION|AFECTO|
Habilitado|PT854291-2S|BATERÍA INSTA360 PARA CÁMARA PRO 2|ARTICULO|Unidad|CAMARAS DE ACCION|AFECTO|
Habilitado|CINPBTC/A|ESTACIÓN DE CARGA INSTA360 PARA CÁMARA PRO 2 - CARGADOR|ARTICULO|Unidad|CAMARAS DE ACCION|AFECTO|
Habilitado|CINRSGP/E|CÁMARA INSTA360 ONE RS - 4K EDITION (MÓDULO 4K - SIN MEMORIA MICRO SD)|ARTICULO|Unidad|CAMARAS DE ACCION|AFECTO|
Habilitado|CINRSGP/A|CÁMARA INSTA360 ONE RS - TWIN EDITION (MÓDULOS: 4K Y 360 - SIN MEMORIA MICRO SD)|ARTICULO|Unidad|CAMARAS DE ACCION|AFECTO|
Habilitado|CINRSGP/D|CÁMARA INSTA360 ONE RS - 1 INCH 360 EDITION (MÓDULO 360 CON SENSOR DE 1 PULGADA)|ARTICULO|Unidad|CAMARAS DE ACCION|AFECTO|
Habilitado|ONE-RS-1E-UB|PACK DE ACTUALIZACIÓN INSTA360 ONE RS - 1 INCH EDITION (NO INCLUYE CORE)|ARTICULO|Unidad|CAMARAS DE ACCION|AFECTO|
Habilitado|GO|CÁMARA DE ACCIÓN INSTA360 GO INCLUYE ACCESORIOS|ARTICULO|Unidad|CAMARAS DE ACCION|AFECTO|
Habilitado|GO-2|CÁMARA DE ACCIÓN INSTA360 GO VERSIÓN 2 - INCLUYE ACCESORIOS|ARTICULO|Unidad|CAMARAS DE ACCION|AFECTO|
Habilitado|GO-2-64GB|CÁMARA DE ACCIÓN INSTA360 GO VERSIÓN 2 DE 64GB - INCLUYE ACCESORIOS|ARTICULO|Unidad|CAMARAS DE ACCION|AFECTO|
Habilitado|CINSTAW/A|CÁMARA INSTA360 SPHERE PARA DRONES MAVIC AIR 2 / AIR 2S|ARTICULO|Unidad|CAMARAS DE ACCION|AFECTO|
Habilitado|KTILR|KIT DE ILUMINACION (POR REGULARIZAR)|ARTICULO|Balde|CAMARAS DE ACCION|AFECTO|
Habilitado|CINSAAQ/C|LECTOR QUICK READER INSTA360 - PARA CÁMARA CÁMARA X3|ARTICULO|Unidad|CAMARAS DE ACCION|AFECTO|
Habilitado|CINSTAVH|KIT DE MONTAJE TRASERO PARA BICICLETA EN TERCERA PERSONA INSTA360|ARTICULO|Unidad|CAMARAS DE ACCION|AFECTO|
Habilitado|GP-SSTL|SELFIE STICK- TELESIN|ARTICULO|Unidad|CAMARAS DE ACCION|AFECTO|
Habilitado|TE-HNB-001|COLLAR  MAGNETICO TELESIN INSTA360|ARTICULO|Unidad|CAMARAS DE ACCION|AFECTO|
Habilitado|CINAKDS/A|KIT DE MONTAJE DE UNICORNIO PARA CASCO INSTA360|ARTICULO|Unidad|CAMARAS DE ACCION|AFECTO|
Habilitado|CINSBAQD|PROTECTOR DE PANTALLA PARA INSTA360 X3|ARTICULO|Unidad|CAMARAS DE ACCION|AFECTO|
Habilitado|CINSABBA|INSTA360 FLOW - ESTABILIZADOR PARA CELULAR|ARTICULO|Unidad|CAMARAS DE ACCION|AFECTO|
Habilitado|CINSTAVG|KIT DE MONTAJE DELANTERO PARA BICICLETA EN TERCERA PERSONA INSTA360|ARTICULO|Unidad|CAMARAS DE ACCION|AFECTO|
Habilitado|CINSBBMK|PROTECTOR DE LENTE DE SILICONA - LENS CAP X4|ARTICULO|Unidad|CAMARAS DE ACCION|AFECTO|
Habilitado|CINSBBMJ|CARGADOR RAPIDO HUB INSTA360 X4|ARTICULO|Unidad|CAMARAS DE ACCION|AFECTO|
Habilitado|CINSSBMF|PROTECTOR DE LENTE PREMIUM  - LENS GUARD PREMIUM INSTA360 X4|ARTICULO|Unidad|CAMARAS DE ACCION|AFECTO|
Habilitado|CINSBAQW|CARCASA SUMERGIBLE NEW INVINSIBLE DIVE CASE X3|ARTICULO|Unidad|CAMARAS DE ACCION|AFECTO|
Habilitado|CINSTAV/F|MULTI MOUNT INSTA360|ARTICULO|Unidad|CAMARAS DE ACCION|AFECTO|
Habilitado|GO PRO|GOPRO HERO 10 BLACK|ARTICULO|Unidad|CAMARAS DE ACCION|AFECTO|
Habilitado|CINSAAVW|FLEXIBLE ADHESIVE MOUNT INSTA360|ARTICULO|Unidad|CAMARAS DE ACCION|AFECTO|
Habilitado|CINSBBME|PROTECTOR DE LENTE - LENS GUARD INSTA360 X4|ARTICULO|Unidad|CAMARAS DE ACCION|AFECTO|
Habilitado|CINSBBMD|PROTECTOR DE PANTALLA INSTA360 X4|ARTICULO|Unidad|CAMARAS DE ACCION|AFECTO|
Habilitado|CINSBBMG|CARCASA SUMERGIBLE DIVE CASE INSTA360 X4|ARTICULO|Unidad|CAMARAS DE ACCION|AFECTO|
Habilitado|CINSBBMA|BATERIA INSTA360 X4|ARTICULO|Unidad|CAMARAS DE ACCION|AFECTO|
Habilitado|CINSABMA|CÁMARA INSTA360 X4 (SIN MEMORIA MICRO SD)|ARTICULO|Unidad|CAMARAS DE ACCION|AFECTO|
Habilitado|CINSAAVH|MONTAJE QUICK RELEASE INSTA360|ARTICULO|Unidad|CAMARAS DE ACCION|AFECTO|
Habilitado|CINSAAXT|MONTAJE VERTICAL-HORIZONTAL  INSTA360|ARTICULO|Unidad|CAMARAS DE ACCION|AFECTO|
Habilitado|GP-ARM-TELESIN|ARNÉS DE CASCO INTEGRAL PARA MOTO O MTB 2.0|ARTICULO|Unidad|CAMARAS DE ACCION|AFECTO|
Habilitado|EVO|CÁMARA INSTA360 EVO (3D Y 360)|ARTICULO|Unidad|CAMARAS DE ACCION|AFECTO|
Habilitado|PRO-2|CÁMARA PROFESIONAL INSTA360 PRO 2 - INCLUYE FARSIGHT PARA MONITOREO A DISTANCIA|ARTICULO|Unidad|CAMARAS DE ACCION|AFECTO|
Habilitado|INSTA-CORE-RS|MÓDULO DE CÁMARA CORE INSTA360 ONE RS|ARTICULO|Unidad|CAMARAS DE ACCION|AFECTO|
Habilitado|CINORSC/E|MONTURA DE ZAPATA INSTA360 PARA CÁMARA ONE RS - COLD SHOE|ARTICULO|Unidad|CAMARAS DE ACCION|AFECTO|
Habilitado|CINSPHD/E|INVISIBLE SELFIE STICK INSTA360 PARA ONE R, ONE X - 70CM MAX - 16.5CM MIN|ARTICULO|Unidad|CAMARAS DE ACCION|AFECTO|
Habilitado|CINAQBT/A|BATERÍA INSTA360 PARA CÁMARA X3 - 1800MAH|ARTICULO|Unidad|CAMARAS DE ACCION|AFECTO|
Habilitado|CINSAAQ/A|"CARGADOR TRIPLE INSTA360 PARA BATERÍAS DE CÁMARA X3 - CARGA
RÁPIDA"|ARTICULO|Unidad|CAMARAS DE ACCION|AFECTO|
Habilitado|CINSAAVF|"INVISIBLE SELFIE STICK INSTA360 - 114CM - REFORZADO - VERSIÓN
2023"|ARTICULO|Unidad|CAMARAS DE ACCION|AFECTO|
Habilitado|CINSAAVE|INVISIBLE SELFIE STICK INSTA360 PARA ONE X2, X3 - 72CM MAX - 18.5CM MIN - REFORZADO|ARTICULO|Unidad|CAMARAS DE ACCION|AFECTO|
Habilitado|CINSPHD/D.1|INVISIBLE SELFIE STICK INSTA360 PARA ONE R, ONE X - 120CM MAX - 23.5CM MIN|ARTICULO|Unidad|CAMARAS DE ACCION|AFECTO|
Habilitado|CINSPHD/F|POWER SELFIE STICK INSTA360 PARA CÁMARA ONE X2|ARTICULO|Unidad|CAMARAS DE ACCION|AFECTO|
Habilitado|CINX2CB/G|2 EN 1 INVISIBLE SELFIE STICK + TRÍPODE INSTA360 PARA ONE X, ONE X2, ONE R, GO 2|ARTICULO|Unidad|CAMARAS DE ACCION|AFECTO|
Habilitado|CINGBTH/B|ACCESORIO BULLET TIME (EFECTO MATRIX) PARA CÁMARA INSTA360 ONE X (PACK SELFIE Y AGARRADERA)|ARTICULO|Unidad|CAMARAS DE ACCION|AFECTO|
Habilitado|CINAB|AGARRADERA - MINITRÍPODE PARA EFECTO BULLET TIME (SIN SELFIE STICK)|ARTICULO|Unidad|CAMARAS DE ACCION|AFECTO|
Habilitado|CING2CB/E|SOPORTE MONKEY TAIL PARA CÁMARAS INSTA360 ONE X2 R RS GO2|ARTICULO|Unidad|CAMARAS DE ACCION|AFECTO|
Habilitado|CINOXBT/A|BATERÍA INSTA360 PARA CÁMARA ONE X|ARTICULO|Unidad|CAMARAS DE ACCION|AFECTO|
Habilitado|DINEESS/A|EXTENDED SELFIE STICK INSTA360 PARA ONE X - 3 METROS|ARTICULO|Unidad|CAMARAS DE ACCION|AFECTO|
Habilitado|DINEESS/B|EXTENDED SELFIE STICK INSTA360 PARA ONE X, ONE R, ONE X2 - 3 METROS NEW VERSION|ARTICULO|Unidad|CAMARAS DE ACCION|AFECTO|
Habilitado|CINSTAV/B|MONTURA INVISIBLE QUICK RELEASE - PARA CÁMARAS INSTA360 ONE RS X2 R X GO2|ARTICULO|Unidad|CAMARAS DE ACCION|AFECTO|
Habilitado|CINSBAJC|PROTECTOR DE PANTALLA INSTA360 ACE PRO|ARTICULO|Unidad|CAMARAS DE ACCION|AFECTO|
Habilitado|CINSBAJF|CARCASA SUMERGIBLE DIVE CASE INSTA360 ACE PRO|ARTICULO|Unidad|CAMARAS DE ACCION|AFECTO|
Habilitado|CINSAAXK|ESTUCHE FLOTADOR INSTA360 ACE PRO|ARTICULO|Unidad|CAMARAS DE ACCION|AFECTO|
Habilitado|CINSBBBA|INSTA360 FLOW SPOTLIGHT|ARTICULO|Unidad|CAMARAS DE ACCION|AFECTO|
Habilitado|CINX2CB/B|CARCASA SUMERGIBLE INSTA360 PARA ONE X 2 (HASTA 45 METROS) - DIVE CASE|ARTICULO|Unidad|CAMARAS DE ACCION|AFECTO|
Habilitado|CINX2CB/A|CARGADOR TRIPLE INSTA360 PARA BATERÍAS DE CÁMARA ONE X 2 - CARGA RÁPIDA|ARTICULO|Unidad|CAMARAS DE ACCION|AFECTO|
Habilitado|DINMBBD/B|MONTURA U-BOLT INSTA360 PARA MOTOCICLETA|ARTICULO|Unidad|CAMARAS DE ACCION|AFECTO|
Habilitado|CINX2CB/I|PROTECTORES DE LENTE PREMIUM INSTA360 PARA CÁMARA ONE X 2 - PREMIUM LENS GUARDS|ARTICULO|Unidad|CAMARAS DE ACCION|AFECTO|
Habilitado|CINSAAJA|CAMARA DE ACCION  INSTA360 ACE PRO|ARTICULO|Unidad|CAMARAS DE ACCION|AFECTO|
Habilitado|INSTA-UTI-FRAME|CARCASA DE ACCESORIOS SMALLRIG PARA CÁMARA INSTA360 ONE X2 - UTILITY FRAME|ARTICULO|Unidad|CAMARAS DE ACCION|AFECTO|
Habilitado|CINCHUX/A|SOPORTE Y ACCESORIOS INSTA360 PARA CASCO|ARTICULO|Unidad|CAMARAS DE ACCION|AFECTO|
Habilitado|INSTA-GO2-ND-4-PACK|PACK DE FILTROS ND FREEWELL PARA CÁMARA INSTA360 GO 2|ARTICULO|Unidad|CAMARAS DE ACCION|AFECTO|
Habilitado|CING2CB/H|PACK DE ADAPTADORES DE MONTURA INSTA360 PARA CÁMARA GO 2|ARTICULO|Unidad|CAMARAS DE ACCION|AFECTO|
Habilitado|CING2CB/J|SOPORTE PARA MASCOTA INSTA360 PARA CÁMARA GO 2 - PET STRAP MOUNT|ARTICULO|Unidad|CAMARAS DE ACCION|AFECTO|
Habilitado|INSTA-POV|SOPORTE DE BOCA POV PARA CÁMARAS DE ACCIÓN GO2, ONE X2, ONE R|ARTICULO|Unidad|CAMARAS DE ACCION|AFECTO|
Habilitado|CING2CB/K|CARCASA SUBMARINA INSTA360 PARA CÁMARA GO2|ARTICULO|Unidad|CAMARAS DE ACCION|AFECTO|
Habilitado|CINSBAQM|HORIZONTAL ACTION MOUNT|ARTICULO|Unidad|CAMARAS DE ACCION|AFECTO|
Habilitado|CINSAAVY|MOTORCYCLE BUNDLE|ARTICULO|Unidad|CAMARAS DE ACCION|AFECTO|
Habilitado|CING2CB/Q|MONTURA ADAPTADOR USB INSTA360 PARA CÁMARA GO2|ARTICULO|Unidad|CAMARAS DE ACCION|AFECTO|
Habilitado|GOPROHERO9|GOPRO HERO 9 BLACK|ARTICULO|Unidad|CAMARAS DE ACCION|AFECTO|
Habilitado|CING2CB/I|ESTUCHE RÍGIDO ORIGINAL INSTA360 PARA CÁMARA GO2|ARTICULO|Unidad|CAMARAS DE ACCION|AFECTO|
Habilitado|CING2CB/B|FILTRO PROTECTOR DE LENTE INSTA360 PARA CÁMARA GO2|ARTICULO|Unidad|CAMARAS DE ACCION|AFECTO|
Habilitado|CING2CB/A|ESTUCHE DE CARGA ORIGINAL INSTA360 PARA CÁMARA GO2|ARTICULO|Unidad|CAMARAS DE ACCION|AFECTO|
Habilitado|CINRSCR/A|LECTOR QUICK READER INSTA360 - VERSIÓN HORIZONTAL - PARA CÁMARA CÁMARA ONE R|ARTICULO|Unidad|CAMARAS DE ACCION|AFECTO|
Habilitado|CINTYAV/B|LECTOR QUICK READER INSTA360 - VERSIÓN VERTICAL - PARA CÁMARA CÁMARA ONE X2|ARTICULO|Unidad|CAMARAS DE ACCION|AFECTO|
Habilitado|CINTYAV/A|ADAPTADOR DE MICRÓFONO PARA CÁMARA ONE RS - VERSIÓN HORIZONTAL|ARTICULO|Unidad|CAMARAS DE ACCION|AFECTO|
Habilitado|CINRSBT/A|BATERÍA INSTA360 PARA CÁMARA ONE RS|ARTICULO|Unidad|CAMARAS DE ACCION|AFECTO|
Habilitado|CINRSBT/B|CARCASA SUMERGIBLE PARA CÁMARA INSTA360 ONE RS CON EL MÓDULO 4K BOOST (HASTA 60 METROS)|ARTICULO|Unidad|CAMARAS DE ACCION|AFECTO|
Habilitado|INSTA-360-MOD-2|MODULO DE LENTE 360 SOLO (SIN PROTECTOR DE GOMA, SIN CAJA)|ARTICULO|Unidad|CAMARAS DE ACCION|AFECTO|
Habilitado|CINORLC/A|PROTECTOR DE GOMA DE MÓDUO 360 PARA CÁMARA ONE R / ONE RS|ARTICULO|Unidad|CAMARAS DE ACCION|AFECTO|
Habilitado|GP-MFW-300|3WAY SELFIE STICK|ARTICULO|Unidad|CAMARAS DE ACCION|AFECTO|
Habilitado|CINORBT/A|BATERÍA INSTA360 PARA CÁMARA ONE R (CON CAJA)|ARTICULO|Unidad|CAMARAS DE ACCION|AFECTO|
Habilitado|INSTA-ONE-R-BAT|BATERÍA INSTA360 PARA CÁMARA ONE R (SIN CAJA)|ARTICULO|Unidad|CAMARAS DE ACCION|AFECTO|
Habilitado|INSTA-ONE-R-FRAME|MARCO ORIGINAL PARA CÁMARA INSTA360 ONE R (EL MISMO QUE VIENE CON LA CÁMARA - SIN CAJA)|ARTICULO|Unidad|CAMARAS DE ACCION|AFECTO|
Habilitado|INSTA-ONE-R-CABLE|CABLE ORIGINAL PARA CÁMARA INSTA360 ONE R (EL MISMO QUE VIENE CON LA CÁMARA)|ARTICULO|Unidad|CAMARAS DE ACCION|AFECTO|
Habilitado|CINORAC/A|CABLE DE TRANSFERENCIA INSTA360 PARA CÁMARA ONE R - DATOS Y TRANSMISIÓN EN VIVO|ARTICULO|Unidad|CAMARAS DE ACCION|AFECTO|
Habilitado|CINOSBT/B|BATERÍA INSTA360 PARA CÁMARA ONE X2 - 1420MAH|ARTICULO|Unidad|CAMARAS DE ACCION|AFECTO|
Habilitado|CINOSBT/B-2|BATERÍA INSTA360 PARA CÁMARA ONE X2 - 1630MAH|ARTICULO|Unidad|CAMARAS DE ACCION|AFECTO|
Habilitado|CINX2CB/E|PROTECTORES DE LENTE ADHESIVOS INSTA360 PARA CÁMARA ONE X 2 - LENS GUARDS|ARTICULO|Unidad|CAMARAS DE ACCION|AFECTO|
